{"wo_id":"WO-BOOT-04","verdict":"fail","base_sha":"837e88acdc247c790b0b9785efed98f544584fcb","head_sha":"837e88acdc247c790b0b9785efed98f544584fcb","acceptance":[{"id":"AC-1","result":"pass","evidence":"scripts/wo_validate.py; artifacts/WO-BOOT-04/validation.txt","detail":"The self-test validates the frozen READY work order and exercises an allowed path and a protected path."},{"id":"AC-2","result":"fail","evidence":"tests/test_wo_runner.py; artifacts/WO-BOOT-04/tests.txt","detail":"The fake-Codex lifecycle matrix remains incomplete. Current tests cover helper behavior, not the required runner and verifier success and failure cases."},{"id":"AC-3","result":"pass","evidence":"artifacts/WO-BOOT-04/help.txt; artifacts/WO-BOOT-04/platform-guard.txt","detail":"Both wrappers show help and the recorded non-Darwin invocations stop with exit 2."},{"id":"AC-4","result":"pass","evidence":"scripts/wo_driver.py:preflight; artifacts/WO-BOOT-04/codex-preflight.txt; artifacts/WO-BOOT-04/codex-version.txt","detail":"Preflight checks required flags in both help outputs and records the installed version and missing flags. It fails closed before model invocation."},{"id":"AC-5","result":"pass","evidence":"artifacts/WO-BOOT-04/local-checks.txt; artifacts/WO-BOOT-04/verify.txt","detail":"Evidence records the required ledger, test-fast, diff-check, actionlint, and explicit ./dev verify command with passing output."},{"id":"AC-6","result":"fail","evidence":"scripts/wo_driver.py:main; artifacts/WO-BOOT-04/codex-preflight.txt","detail":"The driver stops after CLI preflight, so it does not execute the work-order lifecycle or a fresh read-only verifier. The installed CLI incompatibility explains the stop but does not satisfy this acceptance criterion."}],"scope_findings":[{"path":"scripts/ledger.py","finding":"The summary converts unavailable token counts from null to zero, presenting unknown usage as measured zero. Preserve null when usage is unavailable; this is an in-scope correction.","severity":"low"},{"path":"scripts/wo_driver.py","finding":"Preflight searches help text with substring checks, so text containing a required flag as part of a longer option could be mistaken for exact flag support. Match parsed option tokens before relying on preflight to authorize execution.","severity":"low"}],"risk_flags":["New/resume orchestration, the verifier lifecycle, and the fake-Codex matrix remain incomplete; fail-closed preflight is not a completed runner.","The known installed CLI flag incompatibility prevents live lifecycle verification. No live executor or verifier call was made."],"summary":"Fail. The allowlist self-test and requested evidence updates are present, and the unsupported-flag stop is appropriate. AC-2 and AC-6 remain unmet. Two small in-scope correctness fixes remain: preserve unknown token usage as null and check exact option tokens in preflight."}