{"wo_id":"WO-BOOT-02","verdict":"fail","base_sha":"2d8e1ea60356d418d7a69cb6c926eacad7f16d08","head_sha":"uncommitted staged diff; HEAD remains at base_sha","acceptance":[{"id":"AC-1","result":"pass","evidence":"AGENTS.md (50 lines), CLAUDE.md","detail":"AGENTS.md is under 200 lines, references OWNER-DIRECTIVES.md, states the Apple Silicon macOS 13+ only policy, and CLAUDE.md points to it."},{"id":"AC-2","result":"pass","evidence":"docs/adr/0001-product-and-platform-locks.md; docs/adr/0002-source-preservation-and-provenance.md; CODING_STANDARD.md; LICENSE","detail":"The dated ADRs record the product, platform, MPL-2.0, dependency, UI, parser/rasterizer, and source-preservation decisions. The C17 standard is consistent with those decisions; the included license is 373 lines."},{"id":"AC-3","result":"pass","evidence":"python3 scripts/ledger.py validate ledger.jsonl → valid ledger: 12 entries","detail":"Read-only validation passed; the seeded BOOT-01 lifecycle reaches merged."},{"id":"AC-4","result":"pass","evidence":"artifacts/WO-BOOT-02/ledger-tests.txt; tests/test_ledger.py","detail":"The recorded run reports 8 passing tests, matching the eight test methods in source, including malformed entries, duplicate run IDs, invalid transitions, failed-append no-mutation, and 24 concurrent subprocess appends. I did not rerun the suite because it writes temporary fixtures."},{"id":"AC-5","result":"pass","evidence":"scripts/ledger.py; artifacts/WO-BOOT-02/append-help.txt; tests/test_ledger.py","detail":"The append implementation uses a repository-local flock lock, writes a same-directory temporary file, fsyncs it, then atomically replaces the ledger while locked. Invalid transitions are rejected before replacement; duplicate run IDs and transitions are checked under the lock. Recorded help and invalid-append tests align with the implementation."},{"id":"AC-6","result":"fail","evidence":"git diff --cached --check passed; staged changed-path allowlist inspection","detail":"Whitespace check passes, but CODING_STANDARD.md is outside the work order allowlist, which names docs/CODING_STANDARD.md. Therefore not all changed paths are allowed."}],"scope_findings":[{"path":"CODING_STANDARD.md","finding":"Staged root-level file is outside the WO-BOOT-02 allowed paths; the allowlist instead names docs/CODING_STANDARD.md.","severity":"low"}],"risk_flags":["Unit tests were not rerun because the suite writes temporary fixtures; the recorded test evidence matches the checked-in test code.","The staged changes are uncommitted, so there is no distinct commit head SHA to report."],"summary":"Fail: AC-6 is violated because CODING_STANDARD.md is outside the active work order allowlist. Read-only ledger validation and git diff --cached --check passed. The implementation and recorded test evidence support the ledger requirements."}