{"wo_id":"WO-BOOT-03","verdict":"fail","base_sha":"4cc8bfbab2ecdda7c4cd72354f99cb28c08ab477","head_sha":"4cc8bfbab2ecdda7c4cd72354f99cb28c08ab477","acceptance":[{"id":"AC-1","result":"pass","evidence":"artifacts/WO-BOOT-03/local-checks.txt","detail":"Records ./dev build, ./dev test-fast, and ./dev verify with exit 0. test-fast is recorded at 0.600 seconds, under 30 seconds."},{"id":"AC-2","result":"pass","evidence":"artifacts/WO-BOOT-03/actionlint.txt","detail":"Records actionlint .github/workflows/ci.yml with exit 0."},{"id":"AC-3","result":"pass","evidence":"artifacts/WO-BOOT-03/ci-policy.txt; .github/workflows/ci.yml","detail":"Policy check passes. The workflow uses only macos-15, pins actions/checkout to a full 40-character SHA, grants contents: read, and defines push, pull_request, and workflow_dispatch triggers."},{"id":"AC-4","result":"fail","evidence":"artifacts/WO-BOOT-03/tests.txt","detail":"Records 14 passing tests, but does not record the required direct command python3 -m unittest tests.test_dev tests.test_ledger. The required invocation is therefore not evidenced."},{"id":"AC-5","result":"pass","evidence":".github/workflows/ci.yml; docs/ci.md; artifacts/WO-BOOT-03/git-remotes.txt","detail":"The workflow has a single macOS job and no secret references, package installation, or cache. With no configured GitHub remote, hosted CI is explicitly reported as not observed/pending."},{"id":"AC-6","result":"pass","evidence":"git diff --cached --check; git diff --cached --name-only","detail":"The staged diff passes whitespace checks, and every staged path is within the work order's allowed paths."}],"scope_findings":[{"path":"OWNER-DIRECTIVES.md","finding":"Untracked and protected; not part of the staged diff and left untouched.","severity":"info"}],"risk_flags":["The staged work is uncommitted; HEAD remains the full base SHA.","AC-4's required direct unittest invocation is not recorded in tests.txt."],"summary":"Fail: AC-1, AC-2, AC-3, AC-5, and AC-6 pass. AC-4 fails because tests.txt records passing output without the required direct command."}